{
  "$schema": "../../../artifact-provenance.schema.json",
  "schemaVersion": 1,
  "artifact": {
    "path": "intro-synth.mp3",
    "role": "intro_synth_legacy_audition",
    "mediaType": "audio/mpeg",
    "sizeBytes": 244591,
    "durationSeconds": 10.9,
    "sha256": "4be574b1b95fa1d2fdab5060c95e07e2d6e2ee27030df92d691b300470b51719"
  },
  "identity": {
    "status": "not_applicable",
    "relatedMusicbrainzRecordingMbid": "7402bbda-e0cf-4960-9b85-d8f6f4f85533"
  },
  "provenance": {
    "kind": "legacy_derived",
    "reproducibility": "unknown",
    "sources": [
      {
        "role": "notation_source",
        "path": "../../../tracks/7402bbda-e0cf-4960-9b85-d8f6f4f85533/score.ly",
        "notes": "Точная версия нотного исходника на момент рендера неизвестна."
      }
    ],
    "command": null,
    "workflow": null,
    "createdAt": "2026-08-02T09:53:04+01:00",
    "notes": "Создано до введения воспроизводимых команд; точные версии инструментов не записаны."
  }
}
