{
  "$schema": "../../../artifact-provenance.schema.json",
  "schemaVersion": 1,
  "artifact": {
    "path": "original-00m58.80-01m10.80.mp3",
    "role": "original_early_solo_clip",
    "mediaType": "audio/mpeg",
    "sizeBytes": 301332,
    "durationSeconds": 12.0,
    "sha256": "3129d75f0863eb8771ec69e178d2639109d112ad09598febd59e34af9a3086f6"
  },
  "identity": {
    "status": "not_applicable",
    "relatedMusicbrainzRecordingMbid": "7402bbda-e0cf-4960-9b85-d8f6f4f85533"
  },
  "provenance": {
    "kind": "derived",
    "reproducibility": "reproducible",
    "sources": [
      {
        "role": "full_mix",
        "path": "../../../tracks/7402bbda-e0cf-4960-9b85-d8f6f4f85533/reference/audio/03. Волки Океана.mp3",
        "sha256": "37633b1684794052d0e1ca5ad333fd9aa2fc2cbb3fc0fa464110c42457429bbc",
        "startSeconds": 58.8,
        "endSeconds": 70.8
      }
    ],
    "command": "nix run .#extract-volki-early-solo",
    "workflow": {
      "path": "../../../flake.nix",
      "gitCommit": "c4392a14499ccd2fcab816a800c4a757f6fc5b28"
    },
    "environment": {
      "nixpkgsRevision": "1559d3daa3ecc813a650b79375ea61b6741b8746",
      "nixpkgsNarHash": "sha256-LQy14TZp77TwbQf40gg1V3jo8FwJG0jGDkAH+zRHqg8=",
      "tools": [
        {
          "name": "FFmpeg",
          "version": "8.1.2"
        }
      ]
    },
    "createdAt": "2026-08-03T22:01:00+01:00"
  }
}
