{
  "$schema": "../../../../artifact-provenance.schema.json",
  "schemaVersion": 1,
  "artifact": {
    "path": "youtube-nDxJJ_aEt2g.webm",
    "role": "full_mix_reference",
    "mediaType": "audio/webm",
    "sizeBytes": 3054107,
    "durationSeconds": 199.541,
    "sha256": "e5c03bed98e78f063fadad2bb7cfb761a44c4d525b6a07a8b63141e9c9d92f30"
  },
  "identity": {
    "status": "unmatched_variant",
    "relatedMusicbrainzRecordingMbid": "e889154d-ae2d-43f0-bd2d-df87d068c0f3",
    "notes": "YouTube-аудио на 10.441 секунды длиннее каталожной записи; одного названия недостаточно для точного сопоставления."
  },
  "provenance": {
    "kind": "download",
    "reproducibility": "reproducible",
    "sources": [
      {
        "role": "upstream_video",
        "url": "https://www.youtube.com/watch?v=nDxJJ_aEt2g",
        "notes": "Аудиопоток формата 251 загружен без перекодирования."
      }
    ],
    "command": "nix run .#fetch-blown-away-reference",
    "workflow": {
      "path": "../../../../flake.nix",
      "gitCommit": "cac941078530dc1b5f2027bf5d9c167beeb9a55e"
    },
    "environment": {
      "nixpkgsRevision": "1559d3daa3ecc813a650b79375ea61b6741b8746",
      "nixpkgsNarHash": "sha256-LQy14TZp77TwbQf40gg1V3jo8FwJG0jGDkAH+zRHqg8=",
      "tools": [
        {
          "name": "yt-dlp",
          "version": "2026.07.04"
        }
      ]
    },
    "createdAt": "2026-08-03T10:28:47+01:00"
  }
}
