{
  "$schema": "../../../artifact-provenance.schema.json",
  "schemaVersion": 1,
  "artifact": {
    "path": "guitar-break-03m11-draft.mp3",
    "role": "guitar_break_legacy_audition",
    "mediaType": "audio/mpeg",
    "sizeBytes": 144676,
    "durationSeconds": 6.6,
    "sha256": "ee904f04048a1bee22b45be29006f513690e5e867b68fd7fe86e28a44be36701"
  },
  "identity": {
    "status": "not_applicable",
    "relatedMusicbrainzRecordingMbid": "7402bbda-e0cf-4960-9b85-d8f6f4f85533"
  },
  "provenance": {
    "kind": "legacy_derived",
    "reproducibility": "unknown",
    "sources": [
      {
        "role": "notation_source",
        "path": "../../../tracks/7402bbda-e0cf-4960-9b85-d8f6f4f85533/score.ly",
        "notes": "Точная версия нотного исходника на момент рендера неизвестна."
      }
    ],
    "command": null,
    "workflow": null,
    "createdAt": "2026-08-02T09:38:06+01:00",
    "notes": "Создано до введения воспроизводимых команд; точные версии инструментов не записаны."
  }
}
