{
  "$schema": "../../../artifact-provenance.schema.json",
  "schemaVersion": 1,
  "artifact": {
    "path": "early-solo-00m58.80-01m10.80-draft.mp3",
    "role": "early_solo_legacy_audition",
    "mediaType": "audio/mpeg",
    "sizeBytes": 154059,
    "durationSeconds": 6.6,
    "sha256": "a781b8b66dea91b4686f9838b4a4ab70dab92c4bbe15088faa17127351c9af6c"
  },
  "identity": {
    "status": "not_applicable",
    "relatedMusicbrainzRecordingMbid": "7402bbda-e0cf-4960-9b85-d8f6f4f85533"
  },
  "provenance": {
    "kind": "legacy_derived",
    "reproducibility": "unknown",
    "sources": [
      {
        "role": "notation_source",
        "path": "../../../tracks/7402bbda-e0cf-4960-9b85-d8f6f4f85533/score.ly",
        "notes": "Точная версия нотного исходника на момент рендера неизвестна."
      }
    ],
    "command": null,
    "workflow": null,
    "createdAt": "2026-08-02T09:38:06+01:00",
    "notes": "Создано до введения воспроизводимых команд; точные версии инструментов не записаны."
  }
}
