{
  "$schema": "../../../artifact-provenance.schema.json",
  "schemaVersion": 1,
  "artifact": {
    "path": "blown-away-original-left-candidate-v2-right-slow.mp3",
    "role": "slowed_stereo_comparison",
    "mediaType": "audio/mpeg",
    "sizeBytes": 339717,
    "durationSeconds": 14.521083,
    "sha256": "a3ac6f876040489c865fb287797aef6133f467c62c8f71d61cbaf5442eb14329"
  },
  "identity": {
    "status": "not_applicable",
    "relatedMusicbrainzRecordingMbid": "e889154d-ae2d-43f0-bd2d-df87d068c0f3"
  },
  "provenance": {
    "kind": "derived",
    "reproducibility": "partial",
    "sources": [
      {
        "role": "stereo_comparison",
        "path": "blown-away-original-left-candidate-v2-right.mp3",
        "sha256": "612e803ad1386892f91780968e4db17688a9eace98f8cbcedba30bd5428ba05b"
      }
    ],
    "command": null,
    "workflow": null,
    "environment": {
      "nixpkgsRevision": "1559d3daa3ecc813a650b79375ea61b6741b8746",
      "nixpkgsNarHash": "sha256-LQy14TZp77TwbQf40gg1V3jo8FwJG0jGDkAH+zRHqg8=",
      "tools": [
        {
          "name": "FFmpeg",
          "version": "8.1.2"
        }
      ]
    },
    "createdAt": "2026-08-03T21:53:35+01:00",
    "notes": "Стереосравнение замедлено фильтром atempo=0.75; точная команда пока не вынесена в workflow."
  }
}
