{
  "$schema": "../../../artifact-provenance.schema.json",
  "schemaVersion": 1,
  "artifact": {
    "path": "synth-solo-repeated.mp3",
    "role": "synth_solo_legacy_audition",
    "mediaType": "audio/mpeg",
    "sizeBytes": 269174,
    "durationSeconds": 12.4,
    "sha256": "33e7795384c224a02683762a254c11c067747cc5da8a2830476df41cf09ce85a"
  },
  "identity": {
    "status": "not_applicable",
    "relatedMusicbrainzRecordingMbid": "7402bbda-e0cf-4960-9b85-d8f6f4f85533"
  },
  "provenance": {
    "kind": "legacy_derived",
    "reproducibility": "unknown",
    "sources": [
      {
        "role": "notation_source",
        "path": "../../../tracks/7402bbda-e0cf-4960-9b85-d8f6f4f85533/score.ly",
        "notes": "Точная версия нотного исходника на момент рендера неизвестна."
      }
    ],
    "command": null,
    "workflow": null,
    "createdAt": "2026-08-02T09:38:06+01:00",
    "notes": "Создано до введения воспроизводимых команд; точные версии инструментов не записаны."
  }
}
