{
  "$schema": "../../../artifact-provenance.schema.json",
  "schemaVersion": 1,
  "artifact": {
    "path": "blown-away-rhythm-candidate-v2.mp3",
    "role": "solo_rhythm_audition_candidate",
    "mediaType": "audio/mpeg",
    "sizeBytes": 201432,
    "durationSeconds": 10.9,
    "sha256": "6aae3597f557e79601d0217a2878d5922cae405292a039ebb0622adbe08adee8"
  },
  "identity": {
    "status": "not_applicable",
    "relatedMusicbrainzRecordingMbid": "e889154d-ae2d-43f0-bd2d-df87d068c0f3"
  },
  "provenance": {
    "kind": "derived",
    "reproducibility": "partial",
    "sources": [
      {
        "role": "notation_source",
        "path": "blown-away-rhythm-candidate-v2.ly",
        "sha256": "7d0b2e5ce64eab63e8aca98f5e4c3e9fa1b69bf31fda660102e005b7e0745238"
      },
      {
        "role": "rhythm_reference",
        "path": "original-02m22.70-02m33.60.mp3",
        "sha256": "47abee71a626ce79ef1c25e148a8972c2d4fdd7682fc57d9dbd66116957c8709"
      }
    ],
    "command": null,
    "workflow": null,
    "environment": {
      "nixpkgsRevision": "1559d3daa3ecc813a650b79375ea61b6741b8746",
      "nixpkgsNarHash": "sha256-LQy14TZp77TwbQf40gg1V3jo8FwJG0jGDkAH+zRHqg8=",
      "tools": [
        {
          "name": "LilyPond",
          "version": "2.26.0"
        },
        {
          "name": "TiMidity++",
          "version": "2.15.0"
        },
        {
          "name": "FFmpeg",
          "version": "8.1.2"
        }
      ]
    },
    "createdAt": "2026-08-03T21:52:41+01:00",
    "notes": "Кандидат построен по спектральному выравниванию на сетке 171 BPM; команда ещё не вынесена в отдельный workflow."
  }
}
