{
  "$schema": "../../../artifact-provenance.schema.json",
  "schemaVersion": 1,
  "artifact": {
    "path": "original-02m22.70-02m33.60.mp3",
    "role": "original_solo_clip",
    "mediaType": "audio/mpeg",
    "sizeBytes": 264453,
    "durationSeconds": 10.9,
    "sha256": "47abee71a626ce79ef1c25e148a8972c2d4fdd7682fc57d9dbd66116957c8709"
  },
  "identity": {
    "status": "not_applicable",
    "relatedMusicbrainzRecordingMbid": "e889154d-ae2d-43f0-bd2d-df87d068c0f3"
  },
  "provenance": {
    "kind": "derived",
    "reproducibility": "reproducible",
    "sources": [
      {
        "role": "full_mix_reference",
        "path": "../../../tracks/e889154d-ae2d-43f0-bd2d-df87d068c0f3/reference/audio/youtube-nDxJJ_aEt2g.webm",
        "sha256": "e5c03bed98e78f063fadad2bb7cfb761a44c4d525b6a07a8b63141e9c9d92f30",
        "startSeconds": 142.7,
        "endSeconds": 153.6
      }
    ],
    "command": "nix run .#extract-blown-away-solo",
    "workflow": {
      "path": "../../../flake.nix",
      "gitCommit": "cac941078530dc1b5f2027bf5d9c167beeb9a55e"
    },
    "environment": {
      "nixpkgsRevision": "1559d3daa3ecc813a650b79375ea61b6741b8746",
      "nixpkgsNarHash": "sha256-LQy14TZp77TwbQf40gg1V3jo8FwJG0jGDkAH+zRHqg8=",
      "tools": [
        {
          "name": "FFmpeg",
          "version": "8.1.2"
        }
      ]
    },
    "createdAt": "2026-08-03T10:28:49+01:00"
  }
}
